{
  "schema_version": "1.3.0",
  "generated_at": "2026-09-16T10:56:20.276640+00:00",
  "label": "libsodium 1.0.20 (tag 1.0.20-RELEASE)",
  "build_profile": {
    "repo": "jedisct1/libsodium",
    "commit": "1.0.20-RELEASE",
    "board": "make",
    "make_vars": {},
    "sysroot": {
      "used": false
    }
  },
  "sink": {
    "name": "crypto_sign_ed25519_keypair",
    "language": "c",
    "file": "src/libsodium/crypto_sign/ed25519/ref10/keypair.c",
    "line": 33,
    "category": "SEED_GENERATION",
    "entropy_critical": true,
    "mechanism": "catalogue"
  },
  "config_values": [],
  "chain": [
    {
      "index": 0,
      "kind": "c_call",
      "symbol": "crypto_sign_ed25519_keypair",
      "file": "src/libsodium/crypto_sign/ed25519/ref10/keypair.c",
      "line": 32,
      "detail": "",
      "resolution_verdict": null
    },
    {
      "index": 1,
      "kind": "c_call",
      "symbol": "randombytes_buf",
      "file": "src/libsodium/randombytes/randombytes.c",
      "line": 142,
      "detail": "resolve()",
      "resolution_verdict": "RESOLVED"
    }
  ],
  "terminal": {
    "symbol": "randombytes_buf",
    "category": "LIB_CSPRNG",
    "matched_entry": "randombytes_buf",
    "match_kind": "function_name"
  },
  "status": "CLASSIFIED",
  "unknown_reason": null,
  "confidence": "high",
  "unknown_count": 0,
  "coverage": {
    "sinks_found": 1,
    "sinks_found_by_category": {
      "SEED_GENERATION": 1
    },
    "chains_closed": 1,
    "chains_unknown": 0,
    "percentage_resolved": 100.0,
    "chains": [
      {
        "sink_name": "crypto_sign_ed25519_keypair",
        "sink_category": "SEED_GENERATION",
        "entropy_critical": true,
        "mechanism": "catalogue",
        "file": "src/libsodium/crypto_sign/ed25519/ref10/keypair.c",
        "line": 33,
        "status": "CLASSIFIED",
        "chain": [
          {
            "index": 0,
            "kind": "c_call",
            "symbol": "crypto_sign_ed25519_keypair",
            "file": "src/libsodium/crypto_sign/ed25519/ref10/keypair.c",
            "line": 32,
            "detail": "",
            "resolution_verdict": null
          },
          {
            "index": 1,
            "kind": "c_call",
            "symbol": "randombytes_buf",
            "file": "src/libsodium/randombytes/randombytes.c",
            "line": 142,
            "detail": "resolve()",
            "resolution_verdict": "RESOLVED"
          }
        ],
        "terminal_category": "LIB_CSPRNG",
        "matched_entry": "randombytes_buf",
        "match_kind": "function_name"
      }
    ]
  },
  "policy": {
    "mode": "pr",
    "verdicts": [
      {
        "sink_name": "crypto_sign_ed25519_keypair",
        "status": "CLASSIFIED",
        "terminal_category": "LIB_CSPRNG",
        "verdict": "PASS"
      }
    ],
    "overall_verdict": "PASS"
  }
}
