{
  "schema_version": "1.3.0",
  "generated_at": "2026-10-03T11:25:28.616571+00:00",
  "label": "Trezor core kernel (tag core/v2.9.2, Model T)",
  "build_profile": {
    "repo": "trezor/trezor-firmware",
    "commit": "ff1c4a3",
    "board": "scons",
    "make_vars": {},
    "target_macros": "data/targets/arm-none-eabi-cortex-m4-gcc11.yaml",
    "sysroot": {
      "used": true,
      "cache_key": "alpine-3.16.0-gcc-arm-none-eabi-11.2.0-r2-newlib-4.2.0.20211231-r1",
      "resolved_packages": {
        "gcc-arm-none-eabi": "gcc-arm-none-eabi-11.2.0-r2",
        "newlib-arm-none-eabi": "newlib-arm-none-eabi-4.2.0.20211231-r1"
      }
    }
  },
  "sink": {
    "name": "rng_fill_buffer_strong",
    "language": "c",
    "file": "core/embed/sec/rng/rng_common.c",
    "line": 37,
    "category": "SEED_GENERATION",
    "entropy_critical": true,
    "mechanism": "catalogue"
  },
  "config_values": [],
  "chain": [
    {
      "index": 0,
      "kind": "c_call",
      "symbol": "rng_fill_buffer_strong",
      "file": "core/embed/sec/rng/rng_common.c",
      "line": 37,
      "detail": "",
      "resolution_verdict": null
    },
    {
      "index": 1,
      "kind": "c_call",
      "symbol": "rng_fill_buffer",
      "file": "core/embed/sec/rng/stm32/rng.c",
      "line": 66,
      "detail": "resolve()",
      "resolution_verdict": "RESOLVED"
    },
    {
      "index": 2,
      "kind": "c_call",
      "symbol": "rng_get_u32",
      "file": "core/embed/sec/rng/stm32/rng.c",
      "line": 53,
      "detail": "local",
      "resolution_verdict": "local"
    },
    {
      "index": 3,
      "kind": "c_call",
      "symbol": "rng_read_u32",
      "file": "core/embed/sec/rng/stm32/rng.c",
      "line": 40,
      "detail": "local",
      "resolution_verdict": "local"
    }
  ],
  "terminal": {
    "symbol": "rng_read_u32",
    "category": "HW_TRNG",
    "matched_entry": "RNG_TypeDef",
    "match_kind": "body_contains"
  },
  "status": "CLASSIFIED",
  "unknown_reason": null,
  "confidence": "high",
  "unknown_count": 0,
  "entropy_shape": "single",
  "contributions": [
    {
      "source_expr": "rng_fill_buffer_strong",
      "status": "CLASSIFIED",
      "terminal_category": "HW_TRNG",
      "chain": [
        {
          "index": 0,
          "kind": "c_call",
          "symbol": "rng_fill_buffer_strong",
          "file": "core/embed/sec/rng/rng_common.c",
          "line": 37,
          "detail": "",
          "resolution_verdict": null
        },
        {
          "index": 1,
          "kind": "c_call",
          "symbol": "rng_fill_buffer",
          "file": "core/embed/sec/rng/stm32/rng.c",
          "line": 66,
          "detail": "resolve()",
          "resolution_verdict": "RESOLVED"
        },
        {
          "index": 2,
          "kind": "c_call",
          "symbol": "rng_get_u32",
          "file": "core/embed/sec/rng/stm32/rng.c",
          "line": 53,
          "detail": "local",
          "resolution_verdict": "local"
        },
        {
          "index": 3,
          "kind": "c_call",
          "symbol": "rng_read_u32",
          "file": "core/embed/sec/rng/stm32/rng.c",
          "line": 40,
          "detail": "local",
          "resolution_verdict": "local"
        }
      ]
    }
  ],
  "coverage": {
    "sinks_found": 1,
    "sinks_found_by_category": {
      "SEED_GENERATION": 1
    },
    "chains_closed": 1,
    "chains_unknown": 0,
    "percentage_resolved": 100.0,
    "chains": [
      {
        "sink_name": "rng_fill_buffer_strong",
        "sink_category": "SEED_GENERATION",
        "entropy_critical": true,
        "mechanism": "catalogue",
        "file": "core/embed/sec/rng/rng_common.c",
        "line": 37,
        "status": "CLASSIFIED",
        "chain": [
          {
            "index": 0,
            "kind": "c_call",
            "symbol": "rng_fill_buffer_strong",
            "file": "core/embed/sec/rng/rng_common.c",
            "line": 37,
            "detail": "",
            "resolution_verdict": null
          },
          {
            "index": 1,
            "kind": "c_call",
            "symbol": "rng_fill_buffer",
            "file": "core/embed/sec/rng/stm32/rng.c",
            "line": 66,
            "detail": "resolve()",
            "resolution_verdict": "RESOLVED"
          },
          {
            "index": 2,
            "kind": "c_call",
            "symbol": "rng_get_u32",
            "file": "core/embed/sec/rng/stm32/rng.c",
            "line": 53,
            "detail": "local",
            "resolution_verdict": "local"
          },
          {
            "index": 3,
            "kind": "c_call",
            "symbol": "rng_read_u32",
            "file": "core/embed/sec/rng/stm32/rng.c",
            "line": 40,
            "detail": "local",
            "resolution_verdict": "local"
          }
        ],
        "entropy_shape": "single",
        "contributions": [
          {
            "source_expr": "rng_fill_buffer_strong",
            "status": "CLASSIFIED",
            "terminal_category": "HW_TRNG",
            "chain": [
              {
                "index": 0,
                "kind": "c_call",
                "symbol": "rng_fill_buffer_strong",
                "file": "core/embed/sec/rng/rng_common.c",
                "line": 37,
                "detail": "",
                "resolution_verdict": null
              },
              {
                "index": 1,
                "kind": "c_call",
                "symbol": "rng_fill_buffer",
                "file": "core/embed/sec/rng/stm32/rng.c",
                "line": 66,
                "detail": "resolve()",
                "resolution_verdict": "RESOLVED"
              },
              {
                "index": 2,
                "kind": "c_call",
                "symbol": "rng_get_u32",
                "file": "core/embed/sec/rng/stm32/rng.c",
                "line": 53,
                "detail": "local",
                "resolution_verdict": "local"
              },
              {
                "index": 3,
                "kind": "c_call",
                "symbol": "rng_read_u32",
                "file": "core/embed/sec/rng/stm32/rng.c",
                "line": 40,
                "detail": "local",
                "resolution_verdict": "local"
              }
            ]
          }
        ],
        "terminal_category": "HW_TRNG"
      }
    ]
  },
  "policy": {
    "mode": "pr",
    "verdicts": [
      {
        "sink_name": "rng_fill_buffer_strong",
        "status": "CLASSIFIED",
        "terminal_category": "HW_TRNG",
        "verdict": "PASS"
      }
    ],
    "overall_verdict": "PASS"
  }
}
