{
  "schema_version": "1.3.0",
  "generated_at": "2026-10-03T11:25:19.408917+00:00",
  "label": "Trezor core firmware (tag core/v2.9.2, Model T)",
  "build_profile": {
    "repo": "trezor/trezor-firmware",
    "commit": "ff1c4a3",
    "board": "scons",
    "make_vars": {},
    "target_macros": "data/targets/arm-none-eabi-cortex-m4-gcc11.yaml",
    "sysroot": {
      "used": true,
      "cache_key": "alpine-3.16.0-gcc-arm-none-eabi-11.2.0-r2-newlib-4.2.0.20211231-r1",
      "resolved_packages": {
        "gcc-arm-none-eabi": "gcc-arm-none-eabi-11.2.0-r2",
        "newlib-arm-none-eabi": "newlib-arm-none-eabi-4.2.0.20211231-r1"
      }
    }
  },
  "sink": {
    "name": "reset_device",
    "language": "python",
    "file": "core/src/apps/management/reset_device/__init__.py",
    "line": 33,
    "category": "SEED_GENERATION",
    "entropy_critical": true,
    "mechanism": "catalogue"
  },
  "config_values": [],
  "chain": [
    {
      "index": 0,
      "kind": "python_sink",
      "symbol": "reset_device",
      "file": "core/src/apps/management/reset_device/__init__.py",
      "line": 33,
      "detail": "",
      "resolution_verdict": null
    },
    {
      "index": 1,
      "kind": "ffi",
      "symbol": "random.bytes",
      "file": "core/src/apps/management/reset_device/__init__.py",
      "line": 87,
      "detail": "-> mod_trezorcrypto_random_bytes (resolved via 'trezorcrypto.random.bytes': `random` is imported from trezor.crypto at core/src/apps/management/reset_device/__init__.py:35, which re-exports it from trezorcrypto at core/src/trezor/crypto/__init__.py:9)",
      "resolution_verdict": null
    },
    {
      "index": 2,
      "kind": "c_call",
      "symbol": "mod_trezorcrypto_random_bytes",
      "file": "core/embed/upymod/modtrezorcrypto/modtrezorcrypto-random.h",
      "line": 49,
      "detail": "",
      "resolution_verdict": null
    },
    {
      "index": 3,
      "kind": "c_call",
      "symbol": "rng_fill_buffer_strong",
      "file": "core/embed/sys/syscall/stm32/syscall_stubs.c",
      "line": 553,
      "detail": "resolve()",
      "resolution_verdict": "RESOLVED"
    },
    {
      "index": 4,
      "kind": "c_call",
      "symbol": "syscall_invoke2",
      "file": "core/embed/sys/syscall/stm32/syscall_internal.h",
      "line": 69,
      "detail": "local",
      "resolution_verdict": "local"
    }
  ],
  "terminal": null,
  "status": "UNKNOWN",
  "unknown_reason": "'syscall_invoke2' (in 'embed/sys/syscall/stm32/syscall_stubs.c') matched no registry entry and has no further non-runtime call to follow -- candidates tried: []",
  "confidence": "low",
  "unknown_count": 1,
  "entropy_shape": "single",
  "contributions": [
    {
      "source_expr": "random.bytes",
      "status": "UNKNOWN",
      "unknown_reason": "'syscall_invoke2' (in 'embed/sys/syscall/stm32/syscall_stubs.c') matched no registry entry and has no further non-runtime call to follow -- candidates tried: []",
      "chain": [
        {
          "index": 0,
          "kind": "python_sink",
          "symbol": "reset_device",
          "file": "core/src/apps/management/reset_device/__init__.py",
          "line": 33,
          "detail": "",
          "resolution_verdict": null
        },
        {
          "index": 1,
          "kind": "ffi",
          "symbol": "random.bytes",
          "file": "core/src/apps/management/reset_device/__init__.py",
          "line": 87,
          "detail": "-> mod_trezorcrypto_random_bytes (resolved via 'trezorcrypto.random.bytes': `random` is imported from trezor.crypto at core/src/apps/management/reset_device/__init__.py:35, which re-exports it from trezorcrypto at core/src/trezor/crypto/__init__.py:9)",
          "resolution_verdict": null
        },
        {
          "index": 2,
          "kind": "c_call",
          "symbol": "mod_trezorcrypto_random_bytes",
          "file": "core/embed/upymod/modtrezorcrypto/modtrezorcrypto-random.h",
          "line": 49,
          "detail": "",
          "resolution_verdict": null
        },
        {
          "index": 3,
          "kind": "c_call",
          "symbol": "rng_fill_buffer_strong",
          "file": "core/embed/sys/syscall/stm32/syscall_stubs.c",
          "line": 553,
          "detail": "resolve()",
          "resolution_verdict": "RESOLVED"
        },
        {
          "index": 4,
          "kind": "c_call",
          "symbol": "syscall_invoke2",
          "file": "core/embed/sys/syscall/stm32/syscall_internal.h",
          "line": 69,
          "detail": "local",
          "resolution_verdict": "local"
        }
      ]
    }
  ],
  "coverage": {
    "sinks_found": 1,
    "sinks_found_by_category": {
      "SEED_GENERATION": 1
    },
    "chains_closed": 0,
    "chains_unknown": 1,
    "percentage_resolved": 0.0,
    "chains": [
      {
        "sink_name": "reset_device",
        "sink_category": "SEED_GENERATION",
        "entropy_critical": true,
        "mechanism": "catalogue",
        "file": "core/src/apps/management/reset_device/__init__.py",
        "line": 33,
        "status": "UNKNOWN",
        "chain": [
          {
            "index": 0,
            "kind": "python_sink",
            "symbol": "reset_device",
            "file": "core/src/apps/management/reset_device/__init__.py",
            "line": 33,
            "detail": "",
            "resolution_verdict": null
          },
          {
            "index": 1,
            "kind": "ffi",
            "symbol": "random.bytes",
            "file": "core/src/apps/management/reset_device/__init__.py",
            "line": 87,
            "detail": "-> mod_trezorcrypto_random_bytes (resolved via 'trezorcrypto.random.bytes': `random` is imported from trezor.crypto at core/src/apps/management/reset_device/__init__.py:35, which re-exports it from trezorcrypto at core/src/trezor/crypto/__init__.py:9)",
            "resolution_verdict": null
          },
          {
            "index": 2,
            "kind": "c_call",
            "symbol": "mod_trezorcrypto_random_bytes",
            "file": "core/embed/upymod/modtrezorcrypto/modtrezorcrypto-random.h",
            "line": 49,
            "detail": "",
            "resolution_verdict": null
          },
          {
            "index": 3,
            "kind": "c_call",
            "symbol": "rng_fill_buffer_strong",
            "file": "core/embed/sys/syscall/stm32/syscall_stubs.c",
            "line": 553,
            "detail": "resolve()",
            "resolution_verdict": "RESOLVED"
          },
          {
            "index": 4,
            "kind": "c_call",
            "symbol": "syscall_invoke2",
            "file": "core/embed/sys/syscall/stm32/syscall_internal.h",
            "line": 69,
            "detail": "local",
            "resolution_verdict": "local"
          }
        ],
        "entropy_shape": "single",
        "contributions": [
          {
            "source_expr": "random.bytes",
            "status": "UNKNOWN",
            "unknown_reason": "'syscall_invoke2' (in 'embed/sys/syscall/stm32/syscall_stubs.c') matched no registry entry and has no further non-runtime call to follow -- candidates tried: []",
            "chain": [
              {
                "index": 0,
                "kind": "python_sink",
                "symbol": "reset_device",
                "file": "core/src/apps/management/reset_device/__init__.py",
                "line": 33,
                "detail": "",
                "resolution_verdict": null
              },
              {
                "index": 1,
                "kind": "ffi",
                "symbol": "random.bytes",
                "file": "core/src/apps/management/reset_device/__init__.py",
                "line": 87,
                "detail": "-> mod_trezorcrypto_random_bytes (resolved via 'trezorcrypto.random.bytes': `random` is imported from trezor.crypto at core/src/apps/management/reset_device/__init__.py:35, which re-exports it from trezorcrypto at core/src/trezor/crypto/__init__.py:9)",
                "resolution_verdict": null
              },
              {
                "index": 2,
                "kind": "c_call",
                "symbol": "mod_trezorcrypto_random_bytes",
                "file": "core/embed/upymod/modtrezorcrypto/modtrezorcrypto-random.h",
                "line": 49,
                "detail": "",
                "resolution_verdict": null
              },
              {
                "index": 3,
                "kind": "c_call",
                "symbol": "rng_fill_buffer_strong",
                "file": "core/embed/sys/syscall/stm32/syscall_stubs.c",
                "line": 553,
                "detail": "resolve()",
                "resolution_verdict": "RESOLVED"
              },
              {
                "index": 4,
                "kind": "c_call",
                "symbol": "syscall_invoke2",
                "file": "core/embed/sys/syscall/stm32/syscall_internal.h",
                "line": 69,
                "detail": "local",
                "resolution_verdict": "local"
              }
            ]
          }
        ],
        "unknown_reason": "'syscall_invoke2' (in 'embed/sys/syscall/stm32/syscall_stubs.c') matched no registry entry and has no further non-runtime call to follow -- candidates tried: []",
        "broke_at_hop": "syscall_invoke2"
      }
    ]
  },
  "policy": {
    "mode": "pr",
    "verdicts": [
      {
        "sink_name": "reset_device",
        "status": "UNKNOWN",
        "terminal_category": null,
        "verdict": "WARN"
      }
    ],
    "overall_verdict": "WARN"
  }
}
